{
  "$schema": "https://json-schema.org/draft/2020-12/schema",
  "$id": "https://influencer-os.local/schemas/content-strategy.schema.json",
  "title": "ContentStrategy",
  "type": "object",
  "additionalProperties": false,
  "required": [
    "content_strategy_id",
    "creator_profile_id",
    "creator_slug",
    "updated_on",
    "strategy_status",
    "monthly_mix",
    "post_families",
    "content_series",
    "conversion_paths",
    "cadence_principles"
  ],
  "properties": {
    "content_strategy_id": {
      "type": "string",
      "pattern": "^content_strategy_[a-zA-Z0-9_-]+$"
    },
    "creator_profile_id": {
      "type": "string",
      "pattern": "^creator_[a-zA-Z0-9_-]+$"
    },
    "creator_slug": {
      "type": "string",
      "pattern": "^[a-z0-9][a-z0-9-]*$"
    },
    "updated_on": {
      "type": "string",
      "format": "date"
    },
    "strategy_status": {
      "type": "string",
      "enum": [
        "planned",
        "drafted",
        "approved",
        "retired"
      ]
    },
    "monthly_mix": {
      "type": "array",
      "minItems": 1,
      "items": {
        "type": "object",
        "additionalProperties": false,
        "required": [
          "monthly_mix_id",
          "platform",
          "variant_id",
          "target_count_per_month",
          "cadence_note"
        ],
        "properties": {
          "monthly_mix_id": {
            "type": "string",
            "pattern": "^monthly_mix_[a-zA-Z0-9_-]+$"
          },
          "platform": {
            "$ref": "#/definitions/platform"
          },
          "variant_id": {
            "type": "string",
            "pattern": "^variant_[a-zA-Z0-9_-]+$"
          },
          "target_count_per_month": {
            "type": "integer",
            "minimum": 0
          },
          "cadence_note": {
            "type": "string",
            "minLength": 1
          }
        }
      }
    },
    "post_families": {
      "type": "array",
      "minItems": 1,
      "items": {
        "type": "object",
        "additionalProperties": false,
        "required": [
          "family_id",
          "name",
          "purpose",
          "variants"
        ],
        "properties": {
          "family_id": {
            "type": "string",
            "pattern": "^family_[a-zA-Z0-9_-]+$"
          },
          "name": {
            "type": "string",
            "minLength": 1
          },
          "purpose": {
            "type": "string",
            "minLength": 1
          },
          "variants": {
            "type": "array",
            "minItems": 1,
            "items": {
              "type": "object",
              "additionalProperties": false,
              "required": [
                "variant_id",
                "platform",
                "format_id",
                "modality",
                "role"
              ],
              "properties": {
                "variant_id": {
                  "type": "string",
                  "pattern": "^variant_[a-zA-Z0-9_-]+$"
                },
                "platform": {
                  "$ref": "#/definitions/platform"
                },
                "format_id": {
                  "type": "string",
                  "enum": [
                    "format_short_form_video",
                    "format_carousel",
                    "format_single_image_post",
                    "format_story_sequence",
                    "format_article",
                    "format_thread"
                  ]
                },
                "modality": {
                  "type": "string",
                  "enum": [
                    "text",
                    "image",
                    "video",
                    "audio"
                  ]
                },
                "role": {
                  "type": "string",
                  "minLength": 1
                }
              }
            }
          }
        }
      }
    },
    "content_series": {
      "type": "array",
      "items": {
        "type": "object",
        "additionalProperties": false,
        "required": [
          "content_series_id",
          "name",
          "anchor_variant",
          "derivative_variants",
          "conversion_asset_ids",
          "monthly_target",
          "relationship_rule",
          "cadence_note"
        ],
        "properties": {
          "content_series_id": {
            "type": "string",
            "pattern": "^content_series_[a-zA-Z0-9_-]+$"
          },
          "name": {
            "type": "string",
            "minLength": 1
          },
          "anchor_variant": {
            "type": "string",
            "pattern": "^variant_[a-zA-Z0-9_-]+$"
          },
          "derivative_variants": {
            "type": "array",
            "items": {
              "type": "string",
              "pattern": "^variant_[a-zA-Z0-9_-]+$"
            }
          },
          "conversion_asset_ids": {
            "type": "array",
            "items": {
              "type": "string",
              "pattern": "^conversion_asset_[a-zA-Z0-9_-]+$"
            }
          },
          "monthly_target": {
            "type": "integer",
            "minimum": 0
          },
          "relationship_rule": {
            "type": "string",
            "minLength": 1
          },
          "cadence_note": {
            "type": "string",
            "minLength": 1
          }
        }
      }
    },
    "conversion_paths": {
      "type": "array",
      "items": {
        "type": "object",
        "additionalProperties": false,
        "required": [
          "conversion_path_id",
          "name",
          "entry_platforms",
          "conversion_asset_ids",
          "notes"
        ],
        "properties": {
          "conversion_path_id": {
            "type": "string",
            "pattern": "^conversion_path_[a-zA-Z0-9_-]+$"
          },
          "name": {
            "type": "string",
            "minLength": 1
          },
          "entry_platforms": {
            "type": "array",
            "minItems": 1,
            "items": {
              "$ref": "#/definitions/platform"
            }
          },
          "conversion_asset_ids": {
            "type": "array",
            "minItems": 1,
            "items": {
              "type": "string",
              "pattern": "^conversion_asset_[a-zA-Z0-9_-]+$"
            }
          },
          "notes": {
            "type": "string",
            "minLength": 1
          }
        }
      }
    },
    "cadence_principles": {
      "type": "array",
      "minItems": 1,
      "items": {
        "type": "string",
        "minLength": 1
      }
    }
  },
  "definitions": {
    "platform": {
      "type": "string",
      "enum": [
        "x",
        "instagram",
        "tiktok",
        "substack",
        "medium",
        "reddit",
        "facebook",
        "linkedin",
        "youtube"
      ]
    }
  }
}
